{
  "schema_version": 1,
  "artifact_id": "REPLACE_THM_ID",
  "artifact_type": "theorem",
  "title": "REPLACE_TITLE",
  "summary": "REPLACE_ONE_PARAGRAPH_SUMMARY",
  "subject_families": ["REPLACE_SUBJECT_FAMILY"],
  "claim_status": "conjectured",
  "lifecycle_status": "draft",
  "provenance": {"authors": [], "created_utc": null, "origin_repository": "Cella Framework", "source_pointer": null},
  "files": [],
  "claims": [{"claim_id": "REPLACE_CLAIM_ID", "statement": "REPLACE_EXACT_STATEMENT", "hypotheses": [], "scope": "REPLACE_SCOPE", "claim_status": "conjectured", "proof_ids": [], "evidence_ids": []}],
  "relations": [],
  "external_ids": {},
  "declared_impacts": [],
  "llm": {"one_sentence_purpose": "REPLACE_PURPOSE", "key_terms": [], "retrieval_questions": [], "context_priority": "high", "context_role": "core"},
  "visual_hints": {},
  "extensions": {}
}
