{
  "schema_version": 1,
  "artifact_id": "REPLACE_CMA_ID",
  "artifact_type": "campaign",
  "title": "REPLACE_TITLE",
  "summary": "REPLACE_SCOPE_AND_OUTCOME_SUMMARY",
  "subject_families": ["REPLACE_SUBJECT_FAMILY"],
  "claim_status": null,
  "lifecycle_status": "active",
  "provenance": {"authors": [], "created_utc": null, "origin_repository": "Cella Framework", "source_pointer": null},
  "files": [],
  "claims": [],
  "relations": [],
  "external_ids": {"campaigns": ["REPLACE_CMP_ID"], "campaign_artifacts": ["REPLACE_CMA_ID"]},
  "declared_impacts": [],
  "llm": {"one_sentence_purpose": "REPLACE_PURPOSE", "key_terms": [], "retrieval_questions": [], "context_priority": "normal", "context_role": "supporting"},
  "visual_hints": {},
  "extensions": {
    "cma_id": "REPLACE_CMA_ID",
    "campaign_id": "REPLACE_CMP_ID",
    "registry_family": "REPLACE_REGISTRY_FAMILY",
    "dag_node_id": "DBP:campaign:REPLACE_ACRONYM"
  }
}
