{
  "schema_version": 1,
  "artifact_id": "REPLACE_EVD_ID",
  "artifact_type": "evidence",
  "title": "REPLACE_TITLE",
  "summary": "REPLACE_WHAT_THIS_EVIDENCE_ESTABLISHES_AND_DOES_NOT_ESTABLISH",
  "subject_families": ["REPLACE_SUBJECT_FAMILY"],
  "claim_status": "demonstrated",
  "lifecycle_status": "released",
  "provenance": {"authors": [], "created_utc": null, "origin_repository": "Cella Framework", "source_pointer": null},
  "files": [],
  "claims": [],
  "relations": [],
  "external_ids": {},
  "declared_impacts": [],
  "llm": {"one_sentence_purpose": "REPLACE_PURPOSE", "key_terms": [], "retrieval_questions": [], "context_priority": "normal", "context_role": "supporting"},
  "visual_hints": {},
  "extensions": {}
}
