{
  "schema_version": 1,
  "artifact_id": "REPLACE_GAP_ID",
  "artifact_type": "gap",
  "title": "REPLACE_TITLE",
  "summary": "REPLACE_PRECISE_MISSING_OBJECT",
  "subject_families": ["REPLACE_SUBJECT_FAMILY"],
  "claim_status": "open",
  "lifecycle_status": "active",
  "provenance": {"authors": [], "created_utc": null, "origin_repository": "Cella Framework", "source_pointer": null},
  "files": [],
  "claims": [],
  "relations": [],
  "external_ids": {},
  "declared_impacts": [],
  "llm": {"one_sentence_purpose": "REPLACE_PURPOSE", "key_terms": [], "retrieval_questions": [], "context_priority": "high", "context_role": "frontier"},
  "visual_hints": {"reachability": "MODERATE"},
  "extensions": {"next_object": null, "wall_reason": null}
}
