{
  "schema_version": 1,
  "artifact_id": "REPLACE_PRF_ID",
  "artifact_type": "proof",
  "title": "REPLACE_TITLE",
  "summary": "REPLACE_PROOF_ROUTE_SUMMARY",
  "subject_families": ["REPLACE_SUBJECT_FAMILY"],
  "claim_status": "proved",
  "lifecycle_status": "draft",
  "provenance": {"authors": [], "created_utc": null, "origin_repository": "Cella Framework", "source_pointer": null},
  "files": [],
  "claims": [],
  "relations": [{"target_id": "REPLACE_THEOREM_ID", "relation": "proves", "basis": "REPLACE_PROOF_BASIS", "source_pointer": null}],
  "external_ids": {},
  "declared_impacts": [],
  "llm": {"one_sentence_purpose": "REPLACE_PURPOSE", "key_terms": [], "retrieval_questions": [], "context_priority": "normal", "context_role": "supporting"},
  "visual_hints": {},
  "extensions": {}
}
